word_id,french,article,english,phonetic,week_introduced,topic,status,high_frequency,appears_in_reading,appears_in_writing,example_french,example_english,notes
W0617,souvent,,often,listen and repeat,9,frequency,active,yes,yes,yes,Nous mangeons souvent au cafe.,We often eat at the cafe.,new; Week 9 cumulative practice item 17
W0618,parfois,,sometimes,listen and repeat,9,frequency,active,yes,yes,yes,"Parfois, il pleut le matin.","Sometimes, it rains in the morning.",new; Week 9 cumulative practice item 18
W0619,salle de bain,une,bathroom,sahl duh ban,9,rooms,active,yes,yes,yes,La salle de bain est petite.,The bathroom is small.,new; Week 9 cumulative practice item 19
W0620,cuisine,une,kitchen,kwee-ZEEN,9,rooms,active,yes,yes,yes,Je mange dans la cuisine.,I eat in the kitchen.,new; Week 9 cumulative practice item 20
W0621,chambre,une,bedroom,SHAHMBR,9,rooms,active,yes,yes,yes,Je me prepare dans ma chambre.,I get ready in my bedroom.,new; Week 9 cumulative practice item 21
W0622,canape,un,sofa,kah-nah-PAY,9,furniture,active,yes,yes,yes,Le canape est dans le salon.,The sofa is in the living room.,new; Week 9 cumulative practice item 22
W0623,armoire,une,wardrobe,ar-MWAHR,9,furniture,active,yes,yes,yes,L'armoire est pres du lit.,The wardrobe is near the bed.,new; Week 9 cumulative practice item 23
W0624,miroir,un,mirror,mee-RWAHR,9,furniture,active,yes,yes,yes,Le miroir est dans la salle de bain.,The mirror is in the bathroom.,new; Week 9 cumulative practice item 24
W0625,serviette,une,towel,sehr-VYEHT,9,home,active,yes,yes,yes,La serviette est propre.,The towel is clean.,new; Week 9 cumulative practice item 25
W0626,savon,un,soap,sah-VOHN,9,home,active,yes,yes,yes,Il y a du savon dans la salle de bain.,There is soap in the bathroom.,new; Week 9 cumulative practice item 26
W0627,routine,une,routine,roo-TEEN,9,routine,active,yes,yes,yes,Ma routine est simple.,My routine is simple.,new; Week 9 cumulative practice item 27
W0628,journee,une,day / daytime,zhoor-NAY,9,time,active,yes,yes,yes,Ma journee commence tot.,My day starts early.,new; Week 9 cumulative practice item 28
W0629,commencer,,to begin,listen and repeat,9,verbs,active,yes,yes,yes,La journee commence a sept heures.,The day begins at seven.,new; Week 9 cumulative practice item 29
W0630,finir,,to finish,listen and repeat,9,verbs,active,yes,yes,yes,Je finis le travail le soir.,I finish work in the evening.,new; Week 9 cumulative practice item 30
W0631,est-ce que,,question marker,listen and repeat,9,review from Week 7,active,yes,yes,yes,Est-ce que vous voulez une chemise ?,Do you want a shirt?,recent review; Week 9 cumulative practice item 31
W0632,qu est-ce que,,what,listen and repeat,9,review from Week 7,active,yes,yes,yes,Qu est-ce que tu prends ?,What are you taking?,recent review; Week 9 cumulative practice item 32
W0633,combien,,how much / how many,listen and repeat,9,review from Week 7,active,yes,yes,yes,Combien coute le sac ?,How much does the bag cost?,recent review; Week 9 cumulative practice item 33
W0634,ou,,where,listen and repeat,9,review from Week 7,active,yes,yes,yes,Ou est le magasin ?,Where is the store?,recent review; Week 9 cumulative practice item 34
W0635,quand,,when,listen and repeat,9,review from Week 7,active,yes,yes,yes,Quand est-ce que tu vas au magasin ?,When do you go to the store?,recent review; Week 9 cumulative practice item 35
W0636,pourquoi,,why,listen and repeat,9,review from Week 7,active,yes,yes,yes,Pourquoi est-ce que tu prends le bus ?,Why do you take the bus?,recent review; Week 9 cumulative practice item 36
W0637,comment,,how,listen and repeat,9,review from Week 7,active,yes,yes,yes,Comment est la chemise ?,What is the shirt like?,recent review; Week 9 cumulative practice item 37
W0638,je veux,,I want,listen and repeat,9,review from Week 7,active,yes,yes,yes,Je veux une robe rouge.,I want a red dress.,recent review; Week 9 cumulative practice item 38
W0639,vous voulez,,you want,listen and repeat,9,review from Week 7,active,yes,yes,yes,Vous voulez un cafe ?,Do you want a coffee?,recent review; Week 9 cumulative practice item 39
W0640,je prends,,I take,listen and repeat,9,review from Week 7,active,yes,yes,yes,Je prends le sac noir.,I take the black bag.,recent review; Week 9 cumulative practice item 40
W0641,il y a,,there is / there are,listen and repeat,9,review from Week 8,active,yes,yes,yes,Il y a une banque pres du cafe.,There is a bank near the cafe.,recent review; Week 9 cumulative practice item 41
W0642,a gauche,,on the left,listen and repeat,9,review from Week 8,active,yes,yes,yes,La banque est a gauche.,The bank is on the left.,recent review; Week 9 cumulative practice item 42
W0643,a droite,,on the right,listen and repeat,9,review from Week 8,active,yes,yes,yes,Le cafe est a droite.,The cafe is on the right.,recent review; Week 9 cumulative practice item 43
W0644,tout droit,,straight ahead,listen and repeat,9,review from Week 8,active,yes,yes,yes,Marche tout droit jusqu au parc.,Walk straight ahead to the park.,recent review; Week 9 cumulative practice item 44
W0645,tourner,,to turn,listen and repeat,9,review from Week 8,active,yes,yes,yes,Tourne a gauche devant la banque.,Turn left in front of the bank.,recent review; Week 9 cumulative practice item 45
W0646,marcher,,to walk,listen and repeat,9,review from Week 8,active,yes,yes,yes,Alex marche au parc.,Alex walks to the park.,recent review; Week 9 cumulative practice item 46
W0647,prendre le bus,,to take the bus,listen and repeat,9,review from Week 8,active,yes,yes,yes,Je prends le bus pour aller en classe.,I take the bus to go to class.,recent review; Week 9 cumulative practice item 47
W0648,metro,un,subway,may-TROH,9,review from Week 8,active,yes,yes,yes,Le metro est pres de la gare.,The subway is near the station.,recent review; Week 9 cumulative practice item 48
W0649,station,une,station / stop,stah-SYOHN,9,review from Week 8,active,yes,yes,yes,La station est devant le parc.,The stop is in front of the park.,recent review; Week 9 cumulative practice item 49
W0650,gare,une,train station,gahr,9,review from Week 8,active,yes,yes,yes,La gare est loin du cafe.,The train station is far from the cafe.,recent review; Week 9 cumulative practice item 50
W0651,je suis,,I am,zhuh swee,9,review: etre,active,yes,yes,yes,Je suis en classe avec Samira.,I am in class with Samira.,older review; Week 9 cumulative practice item 51
W0652,j'ai,,I have,zhay,9,review: avoir,active,yes,yes,yes,J'ai un cahier et un stylo.,I have a notebook and a pen.,older review; Week 9 cumulative practice item 52
W0653,bonjour,,hello,bohn-ZHOOR,9,review: greeting,active,yes,yes,yes,"Bonjour, je m'appelle Alex.","Hello, my name is Alex.",older review; Week 9 cumulative practice item 53
W0654,la famille,,family,lah fah-MEE,9,review: family,active,yes,yes,yes,La famille de Marc est au cafe.,Marc's family is at the cafe.,older review; Week 9 cumulative practice item 54
W0655,le cafe,,cafe,luh kah-FAY,9,review: place,active,yes,yes,yes,Samira prend un cafe au cafe.,Samira has a coffee at the cafe.,older review; Week 9 cumulative practice item 55
W0656,le bus,,bus,luh boos,9,review: transport,active,yes,yes,yes,Alex prend le bus pour aller en classe.,Alex takes the bus to go to class.,older review; Week 9 cumulative practice item 56
W0657,aujourd hui,,today,oh-zhoor-DWEE,9,review: time,active,yes,yes,yes,"Aujourd'hui, il fait froid.","Today, it is cold.",older review; Week 9 cumulative practice item 57
W0658,une petite table,,a small table,oon puh-TEET tahbl,9,review: adjectives,active,yes,yes,yes,Il y a une petite table dans la cuisine.,There is a small table in the kitchen.,older review; Week 9 cumulative practice item 58
W0659,mon livre,,my book,mohn leevr,9,review: possessives,active,yes,yes,yes,Mon livre est sur le bureau.,My book is on the desk.,older review; Week 9 cumulative practice item 59
W0660,du pain,,some bread,doo pan,9,review: food,active,yes,yes,yes,Je voudrais du pain et de l eau.,I would like some bread and water.,older review; Week 9 cumulative practice item 60
W0661,ou est-ce que,,where is it that,oo ess-kuh,9,review: questions,active,yes,yes,yes,Ou est-ce que Madame Dupont travaille ?,Where does Madame Dupont work?,older review; Week 9 cumulative practice item 61
W0662,je me prepare,,I get ready,zhuh muh pray-PAHR,9,review: routine,active,yes,yes,yes,"Le matin, je me prepare dans ma chambre.","In the morning, I get ready in my bedroom.",older review; Week 9 cumulative practice item 62
W0663,est-ce que,,question marker,listen and repeat,9,review from Week 7,active,yes,yes,yes,Est-ce que vous voulez une chemise ?,Do you want a shirt?,recent review; Week 9 cumulative practice item 63
W0664,qu est-ce que,,what,listen and repeat,9,review from Week 7,active,yes,yes,yes,Qu est-ce que tu prends ?,What are you taking?,recent review; Week 9 cumulative practice item 64
W0665,combien,,how much / how many,listen and repeat,9,review from Week 7,active,yes,yes,yes,Combien coute le sac ?,How much does the bag cost?,recent review; Week 9 cumulative practice item 65
W0666,ou,,where,listen and repeat,9,review from Week 7,active,yes,yes,yes,Ou est le magasin ?,Where is the store?,recent review; Week 9 cumulative practice item 66
W0667,quand,,when,listen and repeat,9,review from Week 7,active,yes,yes,yes,Quand est-ce que tu vas au magasin ?,When do you go to the store?,recent review; Week 9 cumulative practice item 67
W0668,pourquoi,,why,listen and repeat,9,review from Week 7,active,yes,yes,yes,Pourquoi est-ce que tu prends le bus ?,Why do you take the bus?,recent review; Week 9 cumulative practice item 68
W0669,comment,,how,listen and repeat,9,review from Week 7,active,yes,yes,yes,Comment est la chemise ?,What is the shirt like?,recent review; Week 9 cumulative practice item 69
W0670,je veux,,I want,listen and repeat,9,review from Week 7,active,yes,yes,yes,Je veux une robe rouge.,I want a red dress.,recent review; Week 9 cumulative practice item 70
W0671,vous voulez,,you want,listen and repeat,9,review from Week 7,active,yes,yes,yes,Vous voulez un cafe ?,Do you want a coffee?,recent review; Week 9 cumulative practice item 71
W0672,je prends,,I take,listen and repeat,9,review from Week 7,active,yes,yes,yes,Je prends le sac noir.,I take the black bag.,recent review; Week 9 cumulative practice item 72
W0673,il y a,,there is / there are,listen and repeat,9,review from Week 8,active,yes,yes,yes,Il y a une banque pres du cafe.,There is a bank near the cafe.,recent review; Week 9 cumulative practice item 73
W0674,a gauche,,on the left,listen and repeat,9,review from Week 8,active,yes,yes,yes,La banque est a gauche.,The bank is on the left.,recent review; Week 9 cumulative practice item 74
W0675,a droite,,on the right,listen and repeat,9,review from Week 8,active,yes,yes,yes,Le cafe est a droite.,The cafe is on the right.,recent review; Week 9 cumulative practice item 75
W0676,il pleut,,it is raining,listen and repeat,10,weather,active,yes,yes,yes,"Aujourd'hui, il pleut.","Today, it is raining.",new; Week 10 cumulative practice item 1
W0677,il neige,,it is snowing,listen and repeat,10,weather,active,yes,yes,yes,"En hiver, il neige parfois.","In winter, it sometimes snows.",new; Week 10 cumulative practice item 2
W0678,il fait froid,,it is cold,listen and repeat,10,weather,active,yes,yes,yes,Il fait froid le matin.,It is cold in the morning.,new; Week 10 cumulative practice item 3
W0679,il fait chaud,,it is hot,listen and repeat,10,weather,active,yes,yes,yes,"En ete, il fait chaud.","In summer, it is hot.",new; Week 10 cumulative practice item 4
W0680,il fait beau,,the weather is nice,listen and repeat,10,weather,active,yes,yes,yes,"Aujourd'hui, il fait beau.","Today, the weather is nice.",new; Week 10 cumulative practice item 5
W0681,il y a du vent,,it is windy,listen and repeat,10,weather,active,yes,yes,yes,Il y a du vent pres du parc.,It is windy near the park.,new; Week 10 cumulative practice item 6
W0682,soleil,un,sun,soh-LAY,10,weather,active,yes,yes,yes,Il y a du soleil dans la cuisine.,There is sun in the kitchen.,new; Week 10 cumulative practice item 7
W0683,pluie,une,rain,plwee,10,weather,active,yes,yes,yes,La pluie est forte ce matin.,The rain is strong this morning.,new; Week 10 cumulative practice item 8
W0684,neige,une,snow,nehzh,10,weather,active,yes,yes,yes,La neige est blanche.,The snow is white.,new; Week 10 cumulative practice item 9
W0685,nuage,un,cloud,nwahzh,10,weather,active,yes,yes,yes,Il y a un nuage gris.,There is a gray cloud.,new; Week 10 cumulative practice item 10
W0686,saison,une,season,seh-ZOHN,10,time,active,yes,yes,yes,L'hiver est une saison froide.,Winter is a cold season.,new; Week 10 cumulative practice item 11
W0687,printemps,,spring,listen and repeat,10,season,active,yes,yes,yes,"Au printemps, il fait doux.","In spring, it is mild.",new; Week 10 cumulative practice item 12
W0688,ete,,summer,listen and repeat,10,season,active,yes,yes,yes,"En ete, Marc marche au parc.","In summer, Marc walks to the park.",new; Week 10 cumulative practice item 13
W0689,automne,,fall / autumn,listen and repeat,10,season,active,yes,yes,yes,"En automne, il y a du vent.","In autumn, it is windy.",new; Week 10 cumulative practice item 14
W0690,hiver,,winter,listen and repeat,10,season,active,yes,yes,yes,"En hiver, je prends le bus.","In winter, I take the bus.",new; Week 10 cumulative practice item 15
W0691,aujourd'hui,,today,listen and repeat,10,time,active,yes,yes,yes,"Aujourd'hui, je revise.","Today, I review.",new; Week 10 cumulative practice item 16
W0692,demain,,tomorrow,listen and repeat,10,time,active,yes,yes,yes,"Demain, Samira travaille.","Tomorrow, Samira works.",new; Week 10 cumulative practice item 17
W0693,ce matin,,this morning,listen and repeat,10,time,active,yes,yes,yes,"Ce matin, il fait froid.","This morning, it is cold.",new; Week 10 cumulative practice item 18
W0694,ce soir,,this evening,listen and repeat,10,time,active,yes,yes,yes,"Ce soir, je me couche tot.","This evening, I go to bed early.",new; Week 10 cumulative practice item 19
W0695,cette semaine,,this week,listen and repeat,10,time,active,yes,yes,yes,"Cette semaine, je travaille beaucoup.","This week, I work a lot.",new; Week 10 cumulative practice item 20
W0696,quand,,when,listen and repeat,10,connector,active,yes,yes,yes,"Quand il pleut, je reste au cafe.","When it rains, I stay at the cafe.",new; Week 10 cumulative practice item 21
W0697,si,,if,listen and repeat,10,connector,active,yes,yes,yes,"S'il fait beau, nous allons au parc.","If the weather is nice, we go to the park.",new; Week 10 cumulative practice item 22
W0698,rester,,to stay,listen and repeat,10,verbs,active,yes,yes,yes,Samira reste a la maison.,Samira stays at home.,new; Week 10 cumulative practice item 23
W0699,sortir,,to go out,listen and repeat,10,verbs,active,yes,yes,yes,Marc sort quand il fait beau.,Marc goes out when the weather is nice.,new; Week 10 cumulative practice item 24
W0700,manteau,un,coat,mahn-TOH,10,clothes,active,yes,yes,yes,Je prends mon manteau noir.,I take my black coat.,new; Week 10 cumulative practice item 25
W0701,parapluie,un,umbrella,pah-rah-PLWEE,10,weather,active,yes,yes,yes,J'ai un parapluie dans mon sac.,I have an umbrella in my bag.,new; Week 10 cumulative practice item 26
W0702,botte,une,boot,boht,10,clothes,active,yes,yes,yes,Les bottes sont pres de la porte.,The boots are near the door.,new; Week 10 cumulative practice item 27
W0703,doux / douce,,mild / soft,listen and repeat,10,weather,active,yes,yes,yes,"Au printemps, il fait doux.","In spring, it is mild.",new; Week 10 cumulative practice item 28
W0704,fort / forte,,strong,listen and repeat,10,weather,active,yes,yes,yes,Le vent est fort.,The wind is strong.,new; Week 10 cumulative practice item 29
W0705,prevoir,,to plan / forecast,listen and repeat,10,verbs,active,yes,yes,yes,Je prevois une sortie au parc.,I plan an outing to the park.,new; Week 10 cumulative practice item 30
W0706,il y a,,there is / there are,listen and repeat,10,review from Week 8,active,yes,yes,yes,Il y a une banque pres du cafe.,There is a bank near the cafe.,recent review; Week 10 cumulative practice item 31
W0707,a gauche,,on the left,listen and repeat,10,review from Week 8,active,yes,yes,yes,La banque est a gauche.,The bank is on the left.,recent review; Week 10 cumulative practice item 32
W0708,a droite,,on the right,listen and repeat,10,review from Week 8,active,yes,yes,yes,Le cafe est a droite.,The cafe is on the right.,recent review; Week 10 cumulative practice item 33
W0709,tout droit,,straight ahead,listen and repeat,10,review from Week 8,active,yes,yes,yes,Marche tout droit jusqu au parc.,Walk straight ahead to the park.,recent review; Week 10 cumulative practice item 34
W0710,tourner,,to turn,listen and repeat,10,review from Week 8,active,yes,yes,yes,Tourne a gauche devant la banque.,Turn left in front of the bank.,recent review; Week 10 cumulative practice item 35
W0711,marcher,,to walk,listen and repeat,10,review from Week 8,active,yes,yes,yes,Alex marche au parc.,Alex walks to the park.,recent review; Week 10 cumulative practice item 36
W0712,prendre le bus,,to take the bus,listen and repeat,10,review from Week 8,active,yes,yes,yes,Je prends le bus pour aller en classe.,I take the bus to go to class.,recent review; Week 10 cumulative practice item 37
W0713,metro,un,subway,may-TROH,10,review from Week 8,active,yes,yes,yes,Le metro est pres de la gare.,The subway is near the station.,recent review; Week 10 cumulative practice item 38
W0714,station,une,station / stop,stah-SYOHN,10,review from Week 8,active,yes,yes,yes,La station est devant le parc.,The stop is in front of the park.,recent review; Week 10 cumulative practice item 39
W0715,gare,une,train station,gahr,10,review from Week 8,active,yes,yes,yes,La gare est loin du cafe.,The train station is far from the cafe.,recent review; Week 10 cumulative practice item 40
W0716,je me leve,,I get up,listen and repeat,10,review from Week 9,active,yes,yes,yes,Je me leve a sept heures.,I get up at seven o clock.,recent review; Week 10 cumulative practice item 41
W0717,tu te leves,,you get up,listen and repeat,10,review from Week 9,active,yes,yes,yes,Tu te leves tot le lundi.,You get up early on Monday.,recent review; Week 10 cumulative practice item 42
W0718,il se leve / elle se leve,,he/she gets up,listen and repeat,10,review from Week 9,active,yes,yes,yes,Elle se leve avant la classe.,She gets up before class.,recent review; Week 10 cumulative practice item 43
W0719,je me lave,,I wash,listen and repeat,10,review from Week 9,active,yes,yes,yes,Je me lave dans la salle de bain.,I wash in the bathroom.,recent review; Week 10 cumulative practice item 44
W0720,je me prepare,,I get ready,listen and repeat,10,review from Week 9,active,yes,yes,yes,Je me prepare dans ma chambre.,I get ready in my bedroom.,recent review; Week 10 cumulative practice item 45
W0721,je me couche,,I go to bed,listen and repeat,10,review from Week 9,active,yes,yes,yes,Je me couche a dix heures.,I go to bed at ten o clock.,recent review; Week 10 cumulative practice item 46
W0722,se reveiller,,to wake up,listen and repeat,10,review from Week 9,active,yes,yes,yes,Alex se reveille tot.,Alex wakes up early.,recent review; Week 10 cumulative practice item 47
W0723,s habiller,,to get dressed,listen and repeat,10,review from Week 9,active,yes,yes,yes,Samira s'habille le matin.,Samira gets dressed in the morning.,recent review; Week 10 cumulative practice item 48
W0724,se brosser les dents,,to brush teeth,listen and repeat,10,review from Week 9,active,yes,yes,yes,Marc se brosse les dents.,Marc brushes his teeth.,recent review; Week 10 cumulative practice item 49
W0725,matin,un,morning,mah-TAN,10,review from Week 9,active,yes,yes,yes,"Le matin, je prends le bus.","In the morning, I take the bus.",recent review; Week 10 cumulative practice item 50
W0726,je suis,,I am,zhuh swee,10,review: etre,active,yes,yes,yes,Je suis en classe avec Samira.,I am in class with Samira.,older review; Week 10 cumulative practice item 51
W0727,j'ai,,I have,zhay,10,review: avoir,active,yes,yes,yes,J'ai un cahier et un stylo.,I have a notebook and a pen.,older review; Week 10 cumulative practice item 52
W0728,bonjour,,hello,bohn-ZHOOR,10,review: greeting,active,yes,yes,yes,"Bonjour, je m'appelle Alex.","Hello, my name is Alex.",older review; Week 10 cumulative practice item 53
W0729,la famille,,family,lah fah-MEE,10,review: family,active,yes,yes,yes,La famille de Marc est au cafe.,Marc's family is at the cafe.,older review; Week 10 cumulative practice item 54
W0730,le cafe,,cafe,luh kah-FAY,10,review: place,active,yes,yes,yes,Samira prend un cafe au cafe.,Samira has a coffee at the cafe.,older review; Week 10 cumulative practice item 55
W0731,le bus,,bus,luh boos,10,review: transport,active,yes,yes,yes,Alex prend le bus pour aller en classe.,Alex takes the bus to go to class.,older review; Week 10 cumulative practice item 56
W0732,aujourd hui,,today,oh-zhoor-DWEE,10,review: time,active,yes,yes,yes,"Aujourd'hui, il fait froid.","Today, it is cold.",older review; Week 10 cumulative practice item 57
W0733,une petite table,,a small table,oon puh-TEET tahbl,10,review: adjectives,active,yes,yes,yes,Il y a une petite table dans la cuisine.,There is a small table in the kitchen.,older review; Week 10 cumulative practice item 58
W0734,mon livre,,my book,mohn leevr,10,review: possessives,active,yes,yes,yes,Mon livre est sur le bureau.,My book is on the desk.,older review; Week 10 cumulative practice item 59
W0735,du pain,,some bread,doo pan,10,review: food,active,yes,yes,yes,Je voudrais du pain et de l eau.,I would like some bread and water.,older review; Week 10 cumulative practice item 60
W0736,ou est-ce que,,where is it that,oo ess-kuh,10,review: questions,active,yes,yes,yes,Ou est-ce que Madame Dupont travaille ?,Where does Madame Dupont work?,older review; Week 10 cumulative practice item 61
W0737,je me prepare,,I get ready,zhuh muh pray-PAHR,10,review: routine,active,yes,yes,yes,"Le matin, je me prepare dans ma chambre.","In the morning, I get ready in my bedroom.",older review; Week 10 cumulative practice item 62
W0738,il y a,,there is / there are,listen and repeat,10,review from Week 8,active,yes,yes,yes,Il y a une banque pres du cafe.,There is a bank near the cafe.,recent review; Week 10 cumulative practice item 63
W0739,a gauche,,on the left,listen and repeat,10,review from Week 8,active,yes,yes,yes,La banque est a gauche.,The bank is on the left.,recent review; Week 10 cumulative practice item 64
W0740,a droite,,on the right,listen and repeat,10,review from Week 8,active,yes,yes,yes,Le cafe est a droite.,The cafe is on the right.,recent review; Week 10 cumulative practice item 65
W0741,tout droit,,straight ahead,listen and repeat,10,review from Week 8,active,yes,yes,yes,Marche tout droit jusqu au parc.,Walk straight ahead to the park.,recent review; Week 10 cumulative practice item 66
W0742,tourner,,to turn,listen and repeat,10,review from Week 8,active,yes,yes,yes,Tourne a gauche devant la banque.,Turn left in front of the bank.,recent review; Week 10 cumulative practice item 67
W0743,marcher,,to walk,listen and repeat,10,review from Week 8,active,yes,yes,yes,Alex marche au parc.,Alex walks to the park.,recent review; Week 10 cumulative practice item 68
W0744,prendre le bus,,to take the bus,listen and repeat,10,review from Week 8,active,yes,yes,yes,Je prends le bus pour aller en classe.,I take the bus to go to class.,recent review; Week 10 cumulative practice item 69
W0745,metro,un,subway,may-TROH,10,review from Week 8,active,yes,yes,yes,Le metro est pres de la gare.,The subway is near the station.,recent review; Week 10 cumulative practice item 70
W0746,station,une,station / stop,stah-SYOHN,10,review from Week 8,active,yes,yes,yes,La station est devant le parc.,The stop is in front of the park.,recent review; Week 10 cumulative practice item 71
W0747,gare,une,train station,gahr,10,review from Week 8,active,yes,yes,yes,La gare est loin du cafe.,The train station is far from the cafe.,recent review; Week 10 cumulative practice item 72
W0748,je me leve,,I get up,listen and repeat,10,review from Week 9,active,yes,yes,yes,Je me leve a sept heures.,I get up at seven o clock.,recent review; Week 10 cumulative practice item 73
W0749,tu te leves,,you get up,listen and repeat,10,review from Week 9,active,yes,yes,yes,Tu te leves tot le lundi.,You get up early on Monday.,recent review; Week 10 cumulative practice item 74
W0750,il se leve / elle se leve,,he/she gets up,listen and repeat,10,review from Week 9,active,yes,yes,yes,Elle se leve avant la classe.,She gets up before class.,recent review; Week 10 cumulative practice item 75
W0751,je travaille,,I work,listen and repeat,11,present tense,active,yes,yes,yes,Je travaille au bureau.,I work at the office.,new; Week 11 cumulative practice item 1
W0752,tu travailles,,you work,listen and repeat,11,present tense,active,yes,yes,yes,Tu travailles avec Marc.,You work with Marc.,new; Week 11 cumulative practice item 2
W0753,il travaille / elle travaille,,he/she works,listen and repeat,11,present tense,active,yes,yes,yes,Elle travaille le matin.,She works in the morning.,new; Week 11 cumulative practice item 3
W0754,nous travaillons,,we work,listen and repeat,11,present tense,active,yes,yes,yes,Nous travaillons ensemble.,We work together.,new; Week 11 cumulative practice item 4
W0755,j'etudie,,I study,listen and repeat,11,present tense,active,yes,yes,yes,J'etudie le francais le soir.,I study French in the evening.,new; Week 11 cumulative practice item 5
W0756,je prepare,,I prepare,listen and repeat,11,present tense,active,yes,yes,yes,Je prepare un document.,I prepare a document.,new; Week 11 cumulative practice item 6
W0757,je revise,,I review,listen and repeat,11,present tense,active,yes,yes,yes,Je revise la lecon.,I review the lesson.,new; Week 11 cumulative practice item 7
