word_id,french,article,english,phonetic,week_introduced,topic,status,high_frequency,appears_in_reading,appears_in_writing,example_french,example_english,notes
W0471,cher / chere,,expensive,listen and repeat,7,shopping,active,yes,yes,yes,Le manteau est trop cher.,The coat is too expensive.,new; Week 7 cumulative practice item 21
W0472,pas cher,,inexpensive,listen and repeat,7,shopping,active,yes,yes,yes,Ce cahier n est pas cher.,This notebook is inexpensive.,new; Week 7 cumulative practice item 22
W0473,taille,une,size,tahy,7,shopping,active,yes,yes,yes,Quelle taille voulez-vous ?,What size do you want?,new; Week 7 cumulative practice item 23
W0474,petit sac,,small bag,listen and repeat,7,shopping,active,yes,yes,yes,Je prends un petit sac.,I take a small bag.,new; Week 7 cumulative practice item 24
W0475,grand manteau,,big coat,listen and repeat,7,shopping,active,yes,yes,yes,Marc regarde un grand manteau.,Marc looks at a big coat.,new; Week 7 cumulative practice item 25
W0476,quantite,une,quantity,kahn-tee-TAY,7,shopping,active,yes,yes,yes,Quelle quantite voulez-vous ?,What quantity do you want?,new; Week 7 cumulative practice item 26
W0477,un kilo,,one kilogram,listen and repeat,7,shopping,active,yes,yes,yes,Je prends un kilo de pommes.,I take one kilogram of apples.,new; Week 7 cumulative practice item 27
W0478,beaucoup de,,a lot of,listen and repeat,7,quantity,active,yes,yes,yes,Il y a beaucoup de livres.,There are many books.,new; Week 7 cumulative practice item 28
W0479,peu de,,few / little,listen and repeat,7,quantity,active,yes,yes,yes,Il y a peu de chaises.,There are few chairs.,new; Week 7 cumulative practice item 29
W0480,acheter,,to buy,listen and repeat,7,shopping,active,yes,yes,yes,Alex achete un sac pour la classe.,Alex buys a bag for class.,new; Week 7 cumulative practice item 30
W0481,mon,,my masculine,listen and repeat,7,review from Week 5,active,yes,yes,yes,Mon livre est sur le bureau.,My book is on the desk.,recent review; Week 7 cumulative practice item 31
W0482,ma,,my feminine,listen and repeat,7,review from Week 5,active,yes,yes,yes,Ma lampe est jaune.,My lamp is yellow.,recent review; Week 7 cumulative practice item 32
W0483,mes,,my plural,listen and repeat,7,review from Week 5,active,yes,yes,yes,Mes cahiers sont dans mon sac.,My notebooks are in my bag.,recent review; Week 7 cumulative practice item 33
W0484,ton,,your masculine informal,listen and repeat,7,review from Week 5,active,yes,yes,yes,Ton sac est noir.,Your bag is black.,recent review; Week 7 cumulative practice item 34
W0485,ta,,your feminine informal,listen and repeat,7,review from Week 5,active,yes,yes,yes,Ta chambre est claire.,Your bedroom is bright.,recent review; Week 7 cumulative practice item 35
W0486,tes,,your plural informal,listen and repeat,7,review from Week 5,active,yes,yes,yes,Tes stylos sont rouges.,Your pens are red.,recent review; Week 7 cumulative practice item 36
W0487,son,,his/her masculine,listen and repeat,7,review from Week 5,active,yes,yes,yes,Son frere est en classe.,His/her brother is in class.,recent review; Week 7 cumulative practice item 37
W0488,sa,,his/her feminine,listen and repeat,7,review from Week 5,active,yes,yes,yes,Sa soeur est au cafe.,His/her sister is at the cafe.,recent review; Week 7 cumulative practice item 38
W0489,ses,,his/her plural,listen and repeat,7,review from Week 5,active,yes,yes,yes,Ses parents sont gentils.,His/her parents are kind.,recent review; Week 7 cumulative practice item 39
W0490,notre,,our singular,listen and repeat,7,review from Week 5,active,yes,yes,yes,Notre famille est petite.,Our family is small.,recent review; Week 7 cumulative practice item 40
W0491,je voudrais,,I would like,listen and repeat,7,review from Week 6,active,yes,yes,yes,"Je voudrais du cafe, s il vous plait.","I would like some coffee, please.",recent review; Week 7 cumulative practice item 41
W0492,du,,some masculine,listen and repeat,7,review from Week 6,active,yes,yes,yes,Alex prend du pain.,Alex takes some bread.,recent review; Week 7 cumulative practice item 42
W0493,de la,,some feminine,listen and repeat,7,review from Week 6,active,yes,yes,yes,Samira prend de la soupe.,Samira has some soup.,recent review; Week 7 cumulative practice item 43
W0494,de l',,some before vowel,listen and repeat,7,review from Week 6,active,yes,yes,yes,Je voudrais de l'eau.,I would like some water.,recent review; Week 7 cumulative practice item 44
W0495,pas de,,not any,listen and repeat,7,review from Week 6,active,yes,yes,yes,Marc ne veut pas de dessert.,Marc does not want any dessert.,recent review; Week 7 cumulative practice item 45
W0496,cafe,un,coffee / cafe,kah-FAY,7,review from Week 6,active,yes,yes,yes,Je voudrais un cafe chaud.,I would like a hot coffee.,recent review; Week 7 cumulative practice item 46
W0497,eau,une,water,oh,7,review from Week 6,active,yes,yes,yes,Samira boit de l'eau.,Samira drinks water.,recent review; Week 7 cumulative practice item 47
W0498,the,un,tea,tay,7,review from Week 6,active,yes,yes,yes,Madame Dupont prend du the.,Madame Dupont has tea.,recent review; Week 7 cumulative practice item 48
W0499,lait,un,milk,leh,7,review from Week 6,active,yes,yes,yes,Je ne veux pas de lait.,I do not want milk.,recent review; Week 7 cumulative practice item 49
W0500,pain,un,bread,pan,7,review from Week 6,active,yes,yes,yes,Alex mange du pain.,Alex eats bread.,recent review; Week 7 cumulative practice item 50
W0501,je suis,,I am,zhuh swee,7,review: etre,active,yes,yes,yes,Je suis en classe avec Samira.,I am in class with Samira.,older review; Week 7 cumulative practice item 51
W0502,j'ai,,I have,zhay,7,review: avoir,active,yes,yes,yes,J'ai un cahier et un stylo.,I have a notebook and a pen.,older review; Week 7 cumulative practice item 52
W0503,bonjour,,hello,bohn-ZHOOR,7,review: greeting,active,yes,yes,yes,"Bonjour, je m'appelle Alex.","Hello, my name is Alex.",older review; Week 7 cumulative practice item 53
W0504,la famille,,family,lah fah-MEE,7,review: family,active,yes,yes,yes,La famille de Marc est au cafe.,Marc's family is at the cafe.,older review; Week 7 cumulative practice item 54
W0505,le cafe,,cafe,luh kah-FAY,7,review: place,active,yes,yes,yes,Samira prend un cafe au cafe.,Samira has a coffee at the cafe.,older review; Week 7 cumulative practice item 55
W0506,le bus,,bus,luh boos,7,review: transport,active,yes,yes,yes,Alex prend le bus pour aller en classe.,Alex takes the bus to go to class.,older review; Week 7 cumulative practice item 56
W0507,aujourd hui,,today,oh-zhoor-DWEE,7,review: time,active,yes,yes,yes,"Aujourd'hui, il fait froid.","Today, it is cold.",older review; Week 7 cumulative practice item 57
W0508,une petite table,,a small table,oon puh-TEET tahbl,7,review: adjectives,active,yes,yes,yes,Il y a une petite table dans la cuisine.,There is a small table in the kitchen.,older review; Week 7 cumulative practice item 58
W0509,mon livre,,my book,mohn leevr,7,review: possessives,active,yes,yes,yes,Mon livre est sur le bureau.,My book is on the desk.,older review; Week 7 cumulative practice item 59
W0510,du pain,,some bread,doo pan,7,review: food,active,yes,yes,yes,Je voudrais du pain et de l eau.,I would like some bread and water.,older review; Week 7 cumulative practice item 60
W0511,ou est-ce que,,where is it that,oo ess-kuh,7,review: questions,active,yes,yes,yes,Ou est-ce que Madame Dupont travaille ?,Where does Madame Dupont work?,older review; Week 7 cumulative practice item 61
W0512,je me prepare,,I get ready,zhuh muh pray-PAHR,7,review: routine,active,yes,yes,yes,"Le matin, je me prepare dans ma chambre.","In the morning, I get ready in my bedroom.",older review; Week 7 cumulative practice item 62
W0513,mon,,my masculine,listen and repeat,7,review from Week 5,active,yes,yes,yes,Mon livre est sur le bureau.,My book is on the desk.,recent review; Week 7 cumulative practice item 63
W0514,ma,,my feminine,listen and repeat,7,review from Week 5,active,yes,yes,yes,Ma lampe est jaune.,My lamp is yellow.,recent review; Week 7 cumulative practice item 64
W0515,mes,,my plural,listen and repeat,7,review from Week 5,active,yes,yes,yes,Mes cahiers sont dans mon sac.,My notebooks are in my bag.,recent review; Week 7 cumulative practice item 65
W0516,ton,,your masculine informal,listen and repeat,7,review from Week 5,active,yes,yes,yes,Ton sac est noir.,Your bag is black.,recent review; Week 7 cumulative practice item 66
W0517,ta,,your feminine informal,listen and repeat,7,review from Week 5,active,yes,yes,yes,Ta chambre est claire.,Your bedroom is bright.,recent review; Week 7 cumulative practice item 67
W0518,tes,,your plural informal,listen and repeat,7,review from Week 5,active,yes,yes,yes,Tes stylos sont rouges.,Your pens are red.,recent review; Week 7 cumulative practice item 68
W0519,son,,his/her masculine,listen and repeat,7,review from Week 5,active,yes,yes,yes,Son frere est en classe.,His/her brother is in class.,recent review; Week 7 cumulative practice item 69
W0520,sa,,his/her feminine,listen and repeat,7,review from Week 5,active,yes,yes,yes,Sa soeur est au cafe.,His/her sister is at the cafe.,recent review; Week 7 cumulative practice item 70
W0521,ses,,his/her plural,listen and repeat,7,review from Week 5,active,yes,yes,yes,Ses parents sont gentils.,His/her parents are kind.,recent review; Week 7 cumulative practice item 71
W0522,notre,,our singular,listen and repeat,7,review from Week 5,active,yes,yes,yes,Notre famille est petite.,Our family is small.,recent review; Week 7 cumulative practice item 72
W0523,je voudrais,,I would like,listen and repeat,7,review from Week 6,active,yes,yes,yes,"Je voudrais du cafe, s il vous plait.","I would like some coffee, please.",recent review; Week 7 cumulative practice item 73
W0524,du,,some masculine,listen and repeat,7,review from Week 6,active,yes,yes,yes,Alex prend du pain.,Alex takes some bread.,recent review; Week 7 cumulative practice item 74
W0525,de la,,some feminine,listen and repeat,7,review from Week 6,active,yes,yes,yes,Samira prend de la soupe.,Samira has some soup.,recent review; Week 7 cumulative practice item 75
W0526,il y a,,there is / there are,listen and repeat,8,place,active,yes,yes,yes,Il y a une banque pres du cafe.,There is a bank near the cafe.,new; Week 8 cumulative practice item 1
W0527,a gauche,,on the left,listen and repeat,8,directions,active,yes,yes,yes,La banque est a gauche.,The bank is on the left.,new; Week 8 cumulative practice item 2
W0528,a droite,,on the right,listen and repeat,8,directions,active,yes,yes,yes,Le cafe est a droite.,The cafe is on the right.,new; Week 8 cumulative practice item 3
W0529,tout droit,,straight ahead,listen and repeat,8,directions,active,yes,yes,yes,Marche tout droit jusqu au parc.,Walk straight ahead to the park.,new; Week 8 cumulative practice item 4
W0530,tourner,,to turn,listen and repeat,8,directions,active,yes,yes,yes,Tourne a gauche devant la banque.,Turn left in front of the bank.,new; Week 8 cumulative practice item 5
W0531,marcher,,to walk,listen and repeat,8,directions,active,yes,yes,yes,Alex marche au parc.,Alex walks to the park.,new; Week 8 cumulative practice item 6
W0532,prendre le bus,,to take the bus,listen and repeat,8,transport,active,yes,yes,yes,Je prends le bus pour aller en classe.,I take the bus to go to class.,new; Week 8 cumulative practice item 7
W0533,metro,un,subway,may-TROH,8,transport,active,yes,yes,yes,Le metro est pres de la gare.,The subway is near the station.,new; Week 8 cumulative practice item 8
W0534,station,une,station / stop,stah-SYOHN,8,transport,active,yes,yes,yes,La station est devant le parc.,The stop is in front of the park.,new; Week 8 cumulative practice item 9
W0535,gare,une,train station,gahr,8,transport,active,yes,yes,yes,La gare est loin du cafe.,The train station is far from the cafe.,new; Week 8 cumulative practice item 10
W0536,quartier,un,neighborhood,kar-TYAY,8,town,active,yes,yes,yes,Le quartier est calme.,The neighborhood is calm.,new; Week 8 cumulative practice item 11
W0537,rue,une,street,roo,8,town,active,yes,yes,yes,La rue est longue.,The street is long.,new; Week 8 cumulative practice item 12
W0538,parc,un,park,park,8,town,active,yes,yes,yes,Marc attend au parc.,Marc waits at the park.,new; Week 8 cumulative practice item 13
W0539,banque,une,bank,bahnk,8,town,active,yes,yes,yes,La banque est a gauche.,The bank is on the left.,new; Week 8 cumulative practice item 14
W0540,pharmacie,une,pharmacy,far-mah-SEE,8,town,active,yes,yes,yes,La pharmacie est pres de la banque.,The pharmacy is near the bank.,new; Week 8 cumulative practice item 15
W0541,boulangerie,une,bakery,boo-lahn-zhuh-REE,8,town,active,yes,yes,yes,La boulangerie a du pain.,The bakery has bread.,new; Week 8 cumulative practice item 16
W0542,ecole,une,school,ay-KOHL,8,town,active,yes,yes,yes,L'ecole est pres de la station.,The school is near the stop.,new; Week 8 cumulative practice item 17
W0543,bureau de poste,un,post office,boo-ROH duh pohst,8,town,active,yes,yes,yes,Le bureau de poste est a droite.,The post office is on the right.,new; Week 8 cumulative practice item 18
W0544,loin de,,far from,listen and repeat,8,place,active,yes,yes,yes,La gare est loin de ma maison.,The station is far from my house.,new; Week 8 cumulative practice item 19
W0545,pres de,,near,listen and repeat,8,place,active,yes,yes,yes,Le cafe est pres du parc.,The cafe is near the park.,new; Week 8 cumulative practice item 20
W0546,entre,,between,listen and repeat,8,place,active,yes,yes,yes,La banque est entre le cafe et la pharmacie.,The bank is between the cafe and the pharmacy.,new; Week 8 cumulative practice item 21
W0547,en face de,,across from,listen and repeat,8,place,active,yes,yes,yes,L'ecole est en face du parc.,The school is across from the park.,new; Week 8 cumulative practice item 22
W0548,jusqu a,,until / as far as,listen and repeat,8,directions,active,yes,yes,yes,Marche jusqu a la station.,Walk as far as the stop.,new; Week 8 cumulative practice item 23
W0549,plan,un,map / plan,plahn,8,directions,active,yes,yes,yes,Samira regarde le plan du quartier.,Samira looks at the neighborhood map.,new; Week 8 cumulative practice item 24
W0550,route,une,route,root,8,directions,active,yes,yes,yes,La route est facile.,The route is easy.,new; Week 8 cumulative practice item 25
W0551,adresse,une,address,ah-DREHS,8,directions,active,yes,yes,yes,J'ai l'adresse du cafe.,I have the cafe address.,new; Week 8 cumulative practice item 26
W0552,attendre,,to wait,listen and repeat,8,verbs,active,yes,yes,yes,Marc attend devant la boulangerie.,Marc waits in front of the bakery.,new; Week 8 cumulative practice item 27
W0553,arriver,,to arrive,listen and repeat,8,verbs,active,yes,yes,yes,Alex arrive a la station.,Alex arrives at the stop.,new; Week 8 cumulative practice item 28
W0554,partir,,to leave,listen and repeat,8,verbs,active,yes,yes,yes,Nous partons apres la classe.,We leave after class.,new; Week 8 cumulative practice item 29
W0555,demander le chemin,,to ask directions,listen and repeat,8,directions,active,yes,yes,yes,Alex demande le chemin a Samira.,Alex asks Samira for directions.,new; Week 8 cumulative practice item 30
W0556,je voudrais,,I would like,listen and repeat,8,review from Week 6,active,yes,yes,yes,"Je voudrais du cafe, s il vous plait.","I would like some coffee, please.",recent review; Week 8 cumulative practice item 31
W0557,du,,some masculine,listen and repeat,8,review from Week 6,active,yes,yes,yes,Alex prend du pain.,Alex takes some bread.,recent review; Week 8 cumulative practice item 32
W0558,de la,,some feminine,listen and repeat,8,review from Week 6,active,yes,yes,yes,Samira prend de la soupe.,Samira has some soup.,recent review; Week 8 cumulative practice item 33
W0559,de l',,some before vowel,listen and repeat,8,review from Week 6,active,yes,yes,yes,Je voudrais de l'eau.,I would like some water.,recent review; Week 8 cumulative practice item 34
W0560,pas de,,not any,listen and repeat,8,review from Week 6,active,yes,yes,yes,Marc ne veut pas de dessert.,Marc does not want any dessert.,recent review; Week 8 cumulative practice item 35
W0561,cafe,un,coffee / cafe,kah-FAY,8,review from Week 6,active,yes,yes,yes,Je voudrais un cafe chaud.,I would like a hot coffee.,recent review; Week 8 cumulative practice item 36
W0562,eau,une,water,oh,8,review from Week 6,active,yes,yes,yes,Samira boit de l'eau.,Samira drinks water.,recent review; Week 8 cumulative practice item 37
W0563,the,un,tea,tay,8,review from Week 6,active,yes,yes,yes,Madame Dupont prend du the.,Madame Dupont has tea.,recent review; Week 8 cumulative practice item 38
W0564,lait,un,milk,leh,8,review from Week 6,active,yes,yes,yes,Je ne veux pas de lait.,I do not want milk.,recent review; Week 8 cumulative practice item 39
W0565,pain,un,bread,pan,8,review from Week 6,active,yes,yes,yes,Alex mange du pain.,Alex eats bread.,recent review; Week 8 cumulative practice item 40
W0566,est-ce que,,question marker,listen and repeat,8,review from Week 7,active,yes,yes,yes,Est-ce que vous voulez une chemise ?,Do you want a shirt?,recent review; Week 8 cumulative practice item 41
W0567,qu est-ce que,,what,listen and repeat,8,review from Week 7,active,yes,yes,yes,Qu est-ce que tu prends ?,What are you taking?,recent review; Week 8 cumulative practice item 42
W0568,combien,,how much / how many,listen and repeat,8,review from Week 7,active,yes,yes,yes,Combien coute le sac ?,How much does the bag cost?,recent review; Week 8 cumulative practice item 43
W0569,ou,,where,listen and repeat,8,review from Week 7,active,yes,yes,yes,Ou est le magasin ?,Where is the store?,recent review; Week 8 cumulative practice item 44
W0570,quand,,when,listen and repeat,8,review from Week 7,active,yes,yes,yes,Quand est-ce que tu vas au magasin ?,When do you go to the store?,recent review; Week 8 cumulative practice item 45
W0571,pourquoi,,why,listen and repeat,8,review from Week 7,active,yes,yes,yes,Pourquoi est-ce que tu prends le bus ?,Why do you take the bus?,recent review; Week 8 cumulative practice item 46
W0572,comment,,how,listen and repeat,8,review from Week 7,active,yes,yes,yes,Comment est la chemise ?,What is the shirt like?,recent review; Week 8 cumulative practice item 47
W0573,je veux,,I want,listen and repeat,8,review from Week 7,active,yes,yes,yes,Je veux une robe rouge.,I want a red dress.,recent review; Week 8 cumulative practice item 48
W0574,vous voulez,,you want,listen and repeat,8,review from Week 7,active,yes,yes,yes,Vous voulez un cafe ?,Do you want a coffee?,recent review; Week 8 cumulative practice item 49
W0575,je prends,,I take,listen and repeat,8,review from Week 7,active,yes,yes,yes,Je prends le sac noir.,I take the black bag.,recent review; Week 8 cumulative practice item 50
W0576,je suis,,I am,zhuh swee,8,review: etre,active,yes,yes,yes,Je suis en classe avec Samira.,I am in class with Samira.,older review; Week 8 cumulative practice item 51
W0577,j'ai,,I have,zhay,8,review: avoir,active,yes,yes,yes,J'ai un cahier et un stylo.,I have a notebook and a pen.,older review; Week 8 cumulative practice item 52
W0578,bonjour,,hello,bohn-ZHOOR,8,review: greeting,active,yes,yes,yes,"Bonjour, je m'appelle Alex.","Hello, my name is Alex.",older review; Week 8 cumulative practice item 53
W0579,la famille,,family,lah fah-MEE,8,review: family,active,yes,yes,yes,La famille de Marc est au cafe.,Marc's family is at the cafe.,older review; Week 8 cumulative practice item 54
W0580,le cafe,,cafe,luh kah-FAY,8,review: place,active,yes,yes,yes,Samira prend un cafe au cafe.,Samira has a coffee at the cafe.,older review; Week 8 cumulative practice item 55
W0581,le bus,,bus,luh boos,8,review: transport,active,yes,yes,yes,Alex prend le bus pour aller en classe.,Alex takes the bus to go to class.,older review; Week 8 cumulative practice item 56
W0582,aujourd hui,,today,oh-zhoor-DWEE,8,review: time,active,yes,yes,yes,"Aujourd'hui, il fait froid.","Today, it is cold.",older review; Week 8 cumulative practice item 57
W0583,une petite table,,a small table,oon puh-TEET tahbl,8,review: adjectives,active,yes,yes,yes,Il y a une petite table dans la cuisine.,There is a small table in the kitchen.,older review; Week 8 cumulative practice item 58
W0584,mon livre,,my book,mohn leevr,8,review: possessives,active,yes,yes,yes,Mon livre est sur le bureau.,My book is on the desk.,older review; Week 8 cumulative practice item 59
W0585,du pain,,some bread,doo pan,8,review: food,active,yes,yes,yes,Je voudrais du pain et de l eau.,I would like some bread and water.,older review; Week 8 cumulative practice item 60
W0586,ou est-ce que,,where is it that,oo ess-kuh,8,review: questions,active,yes,yes,yes,Ou est-ce que Madame Dupont travaille ?,Where does Madame Dupont work?,older review; Week 8 cumulative practice item 61
W0587,je me prepare,,I get ready,zhuh muh pray-PAHR,8,review: routine,active,yes,yes,yes,"Le matin, je me prepare dans ma chambre.","In the morning, I get ready in my bedroom.",older review; Week 8 cumulative practice item 62
W0588,je voudrais,,I would like,listen and repeat,8,review from Week 6,active,yes,yes,yes,"Je voudrais du cafe, s il vous plait.","I would like some coffee, please.",recent review; Week 8 cumulative practice item 63
W0589,du,,some masculine,listen and repeat,8,review from Week 6,active,yes,yes,yes,Alex prend du pain.,Alex takes some bread.,recent review; Week 8 cumulative practice item 64
W0590,de la,,some feminine,listen and repeat,8,review from Week 6,active,yes,yes,yes,Samira prend de la soupe.,Samira has some soup.,recent review; Week 8 cumulative practice item 65
W0591,de l',,some before vowel,listen and repeat,8,review from Week 6,active,yes,yes,yes,Je voudrais de l'eau.,I would like some water.,recent review; Week 8 cumulative practice item 66
W0592,pas de,,not any,listen and repeat,8,review from Week 6,active,yes,yes,yes,Marc ne veut pas de dessert.,Marc does not want any dessert.,recent review; Week 8 cumulative practice item 67
W0593,cafe,un,coffee / cafe,kah-FAY,8,review from Week 6,active,yes,yes,yes,Je voudrais un cafe chaud.,I would like a hot coffee.,recent review; Week 8 cumulative practice item 68
W0594,eau,une,water,oh,8,review from Week 6,active,yes,yes,yes,Samira boit de l'eau.,Samira drinks water.,recent review; Week 8 cumulative practice item 69
W0595,the,un,tea,tay,8,review from Week 6,active,yes,yes,yes,Madame Dupont prend du the.,Madame Dupont has tea.,recent review; Week 8 cumulative practice item 70
W0596,lait,un,milk,leh,8,review from Week 6,active,yes,yes,yes,Je ne veux pas de lait.,I do not want milk.,recent review; Week 8 cumulative practice item 71
W0597,pain,un,bread,pan,8,review from Week 6,active,yes,yes,yes,Alex mange du pain.,Alex eats bread.,recent review; Week 8 cumulative practice item 72
W0598,est-ce que,,question marker,listen and repeat,8,review from Week 7,active,yes,yes,yes,Est-ce que vous voulez une chemise ?,Do you want a shirt?,recent review; Week 8 cumulative practice item 73
W0599,qu est-ce que,,what,listen and repeat,8,review from Week 7,active,yes,yes,yes,Qu est-ce que tu prends ?,What are you taking?,recent review; Week 8 cumulative practice item 74
W0600,combien,,how much / how many,listen and repeat,8,review from Week 7,active,yes,yes,yes,Combien coute le sac ?,How much does the bag cost?,recent review; Week 8 cumulative practice item 75
W0601,je me leve,,I get up,listen and repeat,9,routine,active,yes,yes,yes,Je me leve a sept heures.,I get up at seven o clock.,new; Week 9 cumulative practice item 1
W0602,tu te leves,,you get up,listen and repeat,9,routine,active,yes,yes,yes,Tu te leves tot le lundi.,You get up early on Monday.,new; Week 9 cumulative practice item 2
W0603,il se leve / elle se leve,,he/she gets up,listen and repeat,9,routine,active,yes,yes,yes,Elle se leve avant la classe.,She gets up before class.,new; Week 9 cumulative practice item 3
W0604,je me lave,,I wash,listen and repeat,9,routine,active,yes,yes,yes,Je me lave dans la salle de bain.,I wash in the bathroom.,new; Week 9 cumulative practice item 4
W0605,je me prepare,,I get ready,listen and repeat,9,routine,active,yes,yes,yes,Je me prepare dans ma chambre.,I get ready in my bedroom.,new; Week 9 cumulative practice item 5
W0606,je me couche,,I go to bed,listen and repeat,9,routine,active,yes,yes,yes,Je me couche a dix heures.,I go to bed at ten o clock.,new; Week 9 cumulative practice item 6
W0607,se reveiller,,to wake up,listen and repeat,9,routine,active,yes,yes,yes,Alex se reveille tot.,Alex wakes up early.,new; Week 9 cumulative practice item 7
W0608,s habiller,,to get dressed,listen and repeat,9,routine,active,yes,yes,yes,Samira s'habille le matin.,Samira gets dressed in the morning.,new; Week 9 cumulative practice item 8
W0609,se brosser les dents,,to brush teeth,listen and repeat,9,routine,active,yes,yes,yes,Marc se brosse les dents.,Marc brushes his teeth.,new; Week 9 cumulative practice item 9
W0610,matin,un,morning,mah-TAN,9,time,active,yes,yes,yes,"Le matin, je prends le bus.","In the morning, I take the bus.",new; Week 9 cumulative practice item 10
W0611,midi,,noon,listen and repeat,9,time,active,yes,yes,yes,"A midi, je mange une salade.","At noon, I eat a salad.",new; Week 9 cumulative practice item 11
W0612,apres-midi,,afternoon,listen and repeat,9,time,active,yes,yes,yes,"L'apres-midi, j'etudie.","In the afternoon, I study.",new; Week 9 cumulative practice item 12
W0613,soir,un,evening,swahr,9,time,active,yes,yes,yes,"Le soir, je revise.","In the evening, I review.",new; Week 9 cumulative practice item 13
W0614,tot,,early,listen and repeat,9,time,active,yes,yes,yes,Samira se leve tot.,Samira gets up early.,new; Week 9 cumulative practice item 14
W0615,tard,,late,listen and repeat,9,time,active,yes,yes,yes,Marc se couche tard.,Marc goes to bed late.,new; Week 9 cumulative practice item 15
W0616,toujours,,always,listen and repeat,9,frequency,active,yes,yes,yes,Je prends toujours mon cahier.,I always take my notebook.,new; Week 9 cumulative practice item 16
